{"$id":"https://offdata.local/schemas/workstream4-readiness.schema.json","$schema":"https://json-schema.org/draft/2020-12/schema","additionalProperties":false,"properties":{"baseline_main_sha":{"pattern":"^[0-9a-f]{40}$","type":"string"},"boundaries":{"type":"object"},"branch_cleanup":{"required":["deletion_policy","verify_merged_ancestry_before_deletion","merged_or_obsolete_branches","explicitly_superseded_branches","superseded_dependabot_branches"],"type":"object"},"canonical_authority":{"type":"object"},"canonical_branch":{"const":"main"},"clean_macos_environment":{"required":["doctor_path","required_os","preferred_architecture","clean_clone_required","no_real_client_data_required","no_credentials_in_repository_required","no_paid_services_required","machine_report_attached","founder_environment_attestation_received","clean_macos_environment_verified"],"type":"object"},"durable_release":{"additionalProperties":false,"properties":{"path":{"const":"releases/pre-codex-chat-first-2026-08-06.json"},"release_id":{"const":"CHAT-FIRST-PRE-CODEX-2026-08-06"},"sha256":{"pattern":"^[0-9a-f]{64}$","type":"string"}},"required":["path","sha256","release_id"],"type":"object"},"generated_from":{"const":"configs/workstream4-readiness.yaml"},"hosted_controls_manual_attestations":{"additionalProperties":{"const":false},"minProperties":8,"type":"object"},"machine_verified_repository_state":{"additionalProperties":{"const":true},"minProperties":10,"type":"object"},"node24_action_pins":{"additionalProperties":false,"properties":{"checkout":{"additionalProperties":false,"properties":{"repository":{"type":"string"},"runtime":{"const":"node24"},"sha":{"pattern":"^[0-9a-f]{40}$","type":"string"},"version":{"type":"string"}},"required":["repository","version","sha","runtime"],"type":"object"},"setup_python":{"additionalProperties":false,"properties":{"repository":{"type":"string"},"runtime":{"const":"node24"},"sha":{"pattern":"^[0-9a-f]{40}$","type":"string"},"version":{"type":"string"}},"required":["repository","version","sha","runtime"],"type":"object"},"upload_artifact":{"additionalProperties":false,"properties":{"repository":{"type":"string"},"runtime":{"const":"node24"},"sha":{"pattern":"^[0-9a-f]{40}$","type":"string"},"version":{"type":"string"}},"required":["repository","version","sha","runtime"],"type":"object"}},"required":["checkout","setup_python","upload_artifact"],"type":"object"},"readiness":{"type":"object"},"readiness_snapshot":{"required":["checks","repository_side_prerequisites_passed","hosted_controls_verified","clean_macos_environment_verified","explicit_founder_phase_0_approval_received","branch_cleanup_complete","workstream_4_complete","codex_start_authorized","next_permitted_phase_after_all_gates"],"type":"object"},"release_evidence":{"required":["release_id","integrated_main_sha","tested_merge_reference","pcr10_artifact_sha256","complete_release_artifact_sha256","issue_1_body_sha256","runtime_tests_passed","coverage_percent","unresolved_references"],"type":"object"},"repository":{"const":"rayrayxing/offdata-os"},"required_status_check":{"additionalProperties":false,"properties":{"job_name":{"const":"Validate complete chat-first Phase 1–7 and PCR-01–10 release"},"workflow_file":{"const":".github/workflows/pcr10-pre-codex-readiness.yml"},"workflow_name":{"const":"PCR-10 pre-Codex readiness and quality acceptance"}},"required":["workflow_file","workflow_name","job_name"],"type":"object"},"schema_version":{"const":"1.0.0"},"status":{"const":"repository_preparation_complete_manual_attestations_pending"},"title":{"type":"string"},"workflow_inventory":{"items":{"additionalProperties":false,"properties":{"official_action_uses":{"items":{"additionalProperties":false,"properties":{"repository":{"type":"string"},"sha":{"pattern":"^[0-9a-f]{40}$","type":"string"}},"required":["repository","sha"],"type":"object"},"type":"array"},"path":{"type":"string"}},"required":["path","official_action_uses"],"type":"object"},"maxItems":8,"minItems":8,"type":"array"},"workflow_pin_failures":{"maxItems":0,"type":"array"},"workstream_id":{"const":"WORKSTREAM-4"}},"required":["schema_version","workstream_id","title","repository","canonical_branch","baseline_main_sha","status","canonical_authority","node24_action_pins","required_status_check","machine_verified_repository_state","hosted_controls_manual_attestations","branch_cleanup","release_evidence","clean_macos_environment","readiness","boundaries","generated_from","workflow_inventory","workflow_pin_failures","readiness_snapshot","durable_release"],"title":"offdata Workstream 4 readiness contract","type":"object"}
