{"baseline_main_sha":"617e4fe59a9f712d75da29f88508819c0296fc84","boundaries":{"autonomous_merge_authorized":false,"external_actions_authorized":false,"founder_accountability_preserved":true,"hermes_activation_authorized":false,"initial_operating_controls_activation_authorized":false,"northstar_implementation_authorized":false,"paid_services_authorized":false,"phase1_authorized":false,"production_deployment_authorized":false,"real_client_data_enabled":false,"runtime_activation_authorized":false},"branch_cleanup":{"deletion_policy":"exact_allowlist_only","explicitly_superseded_branches":[{"branch":"governance/pcr06-hermes-adoption","reason":"superseded_by_governance_pcr06_hermes_compatibility"},{"branch":"governance/pcr09-first-codex-issue","reason":"defective_pcr09_audit_history_superseded_by_clean_replacement"}],"merged_or_obsolete_branches":["agent/phase2-first-agent-system","ci/phase1-contract-validation-20260804","deliverable/phase4-semantic-model","fix/phase1-policy-typing","fix/phase1-policy-typing-2","fixtures/phase5-additional-engagements","fixtures/phase5-engagement-suite","fixtures/phase5-strategy-cost","governance/pcr01-canonical-release","governance/pcr02-test-identity","governance/pcr03-repository-hygiene","governance/pcr04-codex-handoff","governance/pcr05-runtime-adapters","governance/pcr06-hermes-compatibility","governance/pcr07-northstar-integration","governance/pcr08-initial-operating-controls","governance/pcr09-first-codex-issue-clean","governance/pcr10-integration-reconciliation","governance/pcr10-pre-codex-readiness","knowledge/phase6-ingestion-intelligence","oracle/phase3-ai-audit","security/phase7-regionalisation"],"superseded_dependabot_branches":["dependabot/github_actions/actions/checkout-7.0.1","dependabot/github_actions/actions/setup-python-7.0.0","dependabot/github_actions/actions/upload-artifact-7.0.1"],"verify_merged_ancestry_before_deletion":true},"canonical_authority":{"canonical_issue":1,"controlling_instruction":"AGENTS.md","duplicate_issue":2,"final_pre_codex_contract":"contracts/pre-codex-readiness.json","hosted_controls_issue":19},"canonical_branch":"main","clean_macos_environment":{"clean_clone_required":true,"clean_macos_environment_verified":false,"doctor_path":"scripts/doctor_pre_codex_macos.py","founder_environment_attestation_received":false,"machine_report_attached":false,"no_credentials_in_repository_required":true,"no_paid_services_required":true,"no_real_client_data_required":true,"preferred_architecture":"arm64","required_os":"macOS"},"durable_release":{"path":"releases/pre-codex-chat-first-2026-08-06.json","release_id":"CHAT-FIRST-PRE-CODEX-2026-08-06","sha256":"064d6b95bdc70047fd4d1b98ce47230bb5a57a77130db971735d505947bb76a6"},"generated_from":"configs/workstream4-readiness.yaml","hosted_controls_manual_attestations":{"final_status_check_required_for_main":false,"force_push_to_main_blocked":false,"github_mfa_enabled":false,"main_branch_deletion_blocked":false,"merged_head_branches_auto_deleted":false,"pull_request_required_for_main":false,"review_conversation_resolution_required":false,"stale_approvals_dismissed":false},"machine_verified_repository_state":{"canonical_issue_1_open_and_synchronized":true,"clean_macos_doctor_committed":true,"default_branch_is_main":true,"durable_release_manifest_committed":true,"final_main_tree_matches_tested_merge_reference":true,"final_release_workflows_green":true,"issue_2_closed_as_duplicate":true,"node24_exact_pins_committed":true,"pcr03_through_pcr10_integrated":true,"repository_admin_access":true,"repository_private":true},"node24_action_pins":{"checkout":{"repository":"actions/checkout","runtime":"node24","sha":"3d3c42e5aac5ba805825da76410c181273ba90b1","version":"v7.0.1"},"setup_python":{"repository":"actions/setup-python","runtime":"node24","sha":"5fda3b95a4ea91299a34e894583c3862153e4b97","version":"v7.0.0"},"upload_artifact":{"repository":"actions/upload-artifact","runtime":"node24","sha":"043fb46d1a93c77aae656e7c1c64a875d1fc6a0a","version":"v7.0.1"}},"readiness":{"branch_cleanup_complete":false,"clean_macos_environment_verified":false,"codex_start_authorized":false,"explicit_founder_phase_0_approval_received":false,"hosted_controls_verified":false,"next_permitted_phase_after_all_gates":"Codex Phase 0 only","permanent_release_evidence_complete":true,"repository_side_preparation_complete":true,"workstream_4_complete":false},"readiness_snapshot":{"branch_cleanup_complete":false,"checks":{"all_expected_workflows_present":true,"all_official_action_uses_exactly_pinned":true,"clean_macos_attestation_remains_unverified":true,"codex_start_remains_unauthorized":true,"founder_approval_remains_unverified":true,"manual_hosted_attestations_remain_unverified":true,"pre_codex_contract_is_integrated":true,"release_manifest_path_available":true,"required_files_present":true,"required_final_status_check_named":true},"clean_macos_environment_verified":false,"codex_start_authorized":false,"explicit_founder_phase_0_approval_received":false,"hosted_controls_verified":false,"next_permitted_phase_after_all_gates":"Codex Phase 0 only","repository_side_prerequisites_passed":true,"workstream_4_complete":false},"release_evidence":{"complete_release_artifact_id":8955039054,"complete_release_artifact_sha256":"64c6a71c7bbb961c689cdf89a7a9c0ed2c8a670f5c9e29f44d5f28b3306452bd","complete_release_run_id":31069304330,"coverage_percent":93.14,"executable_test_nodes":245,"integrated_main_sha":"617e4fe59a9f712d75da29f88508819c0296fc84","integration_pr":32,"issue_1_body_sha256":"01871803444487ef3e808f155a85cc13ac6fc2350eb11a401e6b5c14fc4a79ad","pcr10_artifact_id":8955036460,"pcr10_artifact_sha256":"9e5425bae029a7a383632767b213e3a1114fb88e44d4c634e5261bf94e322511","pcr10_job_id":92513690720,"pcr10_run_id":31069304377,"reference_edges":604,"release_id":"CHAT-FIRST-PRE-CODEX-2026-08-06","runtime_tests_passed":247,"semantic_tests":99,"tested_merge_reference":"6abc4785422e878c160aeb33065e98967c0e3b89","unresolved_references":0},"repository":"rayrayxing/offdata-os","required_status_check":{"job_name":"Validate complete chat-first Phase 1–7 and PCR-01–10 release","workflow_file":".github/workflows/pcr10-pre-codex-readiness.yml","workflow_name":"PCR-10 pre-Codex readiness and quality acceptance"},"schema_version":"1.0.0","status":"repository_preparation_complete_manual_attestations_pending","title":"Hosted controls, evidence and environment readiness","workflow_inventory":[{"official_action_uses":[{"repository":"actions/checkout","sha":"3d3c42e5aac5ba805825da76410c181273ba90b1"},{"repository":"actions/setup-python","sha":"5fda3b95a4ea91299a34e894583c3862153e4b97"},{"repository":"actions/upload-artifact","sha":"043fb46d1a93c77aae656e7c1c64a875d1fc6a0a"}],"path":".github/workflows/contracts.yml"},{"official_action_uses":[{"repository":"actions/checkout","sha":"3d3c42e5aac5ba805825da76410c181273ba90b1"},{"repository":"actions/setup-python","sha":"5fda3b95a4ea91299a34e894583c3862153e4b97"},{"repository":"actions/upload-artifact","sha":"043fb46d1a93c77aae656e7c1c64a875d1fc6a0a"}],"path":".github/workflows/hermes-compatibility.yml"},{"official_action_uses":[{"repository":"actions/checkout","sha":"3d3c42e5aac5ba805825da76410c181273ba90b1"},{"repository":"actions/setup-python","sha":"5fda3b95a4ea91299a34e894583c3862153e4b97"},{"repository":"actions/upload-artifact","sha":"043fb46d1a93c77aae656e7c1c64a875d1fc6a0a"}],"path":".github/workflows/northstar-integration-blueprint.yml"},{"official_action_uses":[{"repository":"actions/checkout","sha":"3d3c42e5aac5ba805825da76410c181273ba90b1"},{"repository":"actions/setup-python","sha":"5fda3b95a4ea91299a34e894583c3862153e4b97"},{"repository":"actions/upload-artifact","sha":"043fb46d1a93c77aae656e7c1c64a875d1fc6a0a"}],"path":".github/workflows/initial-operating-controls.yml"},{"official_action_uses":[{"repository":"actions/checkout","sha":"3d3c42e5aac5ba805825da76410c181273ba90b1"},{"repository":"actions/setup-python","sha":"5fda3b95a4ea91299a34e894583c3862153e4b97"},{"repository":"actions/upload-artifact","sha":"043fb46d1a93c77aae656e7c1c64a875d1fc6a0a"}],"path":".github/workflows/first-codex-issue.yml"},{"official_action_uses":[{"repository":"actions/checkout","sha":"3d3c42e5aac5ba805825da76410c181273ba90b1"},{"repository":"actions/setup-python","sha":"5fda3b95a4ea91299a34e894583c3862153e4b97"},{"repository":"actions/upload-artifact","sha":"043fb46d1a93c77aae656e7c1c64a875d1fc6a0a"}],"path":".github/workflows/pcr09-final-evidence.yml"},{"official_action_uses":[{"repository":"actions/checkout","sha":"3d3c42e5aac5ba805825da76410c181273ba90b1"},{"repository":"actions/setup-python","sha":"5fda3b95a4ea91299a34e894583c3862153e4b97"},{"repository":"actions/upload-artifact","sha":"043fb46d1a93c77aae656e7c1c64a875d1fc6a0a"}],"path":".github/workflows/pcr10-pre-codex-readiness.yml"},{"official_action_uses":[{"repository":"actions/checkout","sha":"3d3c42e5aac5ba805825da76410c181273ba90b1"},{"repository":"actions/setup-python","sha":"5fda3b95a4ea91299a34e894583c3862153e4b97"},{"repository":"actions/upload-artifact","sha":"043fb46d1a93c77aae656e7c1c64a875d1fc6a0a"},{"repository":"actions/checkout","sha":"3d3c42e5aac5ba805825da76410c181273ba90b1"}],"path":".github/workflows/workstream4-readiness.yml"}],"workflow_pin_failures":[],"workstream_id":"WORKSTREAM-4"}
